video_id,title,publishedAt,channelId,channelTitle,categoryId,trending_date,tags,view_count,likes,dislikes,comment_count,thumbnail_link,comments_disabled,ratings_disabled,description
"gI6xh_wmCu0","냉동 바나나로 망치 만들었는데 파괴력보고 충격먹었습니다 ㅋㅋㅋㅋㅋ [ 바나나 파괴력 테스트 ] 공대생 변승주","2018-10-30T09:53:10.000Z","UChE5nZAIhWS5vYTRjsUgRpQ","공대생 변승주","24","18.01.11","바나나|바나나 먹방|바나나 망치|바나sk|파괴농장|파괴몬|파괴광선|파괴몬스터|파괴의신 박종덕|파괴의신 트런들|정글도 파괴력|비비탄 파괴력|총 파괴력|액스칼리버 파괴력|겐지용검 파괴력|미사일 파괴력|파괴력 순위|파괴력 테스트|냉동|냉동 물고기|냉동 참치|냉동인간|냉동치료|바나sk 알러지원숭이|바나나 알러지원숭이|바나sk 먹방|망치|망치춤|망치부인|망치춤 노래|망치 춤|망치 양념치킨|망치 떡볶이|망치 치킨|공대생 김하나|공대생|공대생 실험|공대생 변승주|라면 고데기","492685","8370","186","2021","https://i.ytimg.com/vi/gI6xh_wmCu0/default.jpg","False","False","이색 실험 추천 받습니다ㅎㅎ광고문의 및 출연 섭외 문의는 mesol@videovillage.co.kr                  hjsbjh2@gmail.com 으로 부탁드려요! 세상에 하찮은 호기심은 없습니다!  이 채널은 궁금한건 뭐든 해봐야 직성이 풀리는 (재작년기준)20살 평범한 공대생이 세상에 있는 모든 신기한것들을 해보는! 사실상 주제 없이 하고 싶은 것 다 하는 평범하지 않은 채널입니다.채널을 만든 목적은 단 하나, 여러분들과 저의 즐거움입니다.유익함보다는 유쾌함이 주가 되는 채널이 되도록 노력하겠습니다 ㅋㅋㅋㅋ오늘도 기앙마 즐거운하루!!!!!!!!!!!!!!!!!!!!!!  (뿌잇)#유튜브 (Youtube) 구독하기 : https://goo.gl/pF280n----------------------------------------­­-----------⊙ 더 다양한 공대생을 만나보고 싶다면?#Facebook :  https://goo.gl/hPzvTb#Instagram :  https://goo.gl/WSlGpW#E-Mail(Fan) : hjsbjh2@gmail.com#E-Mail(Bussinees) : mesol@videovillage.co.kr----------------------------------------­­-----------COPYRIGHT ⓒ 2016 GONGDAESN ALL RIGHTS RESERVED.----------------------------------------­­-----------"
"FXaM6K10jw8","하루종일 손을 바꿨다가 급 민망해진 이유..♡ (feat.핵꿀잼 술게임) [엔조이커플 enjoycouple]","2018-10-31T08:10:12.000Z","UCj-durTg1W7uWsB8oq0u7kA","엔조이커플enjoycouple","24","18.01.11","엔조이커플|엔조이|엔조잉|민뚜|라라|손민수|임라라|개그맨|개그우먼|커플|커플유튜버|웃긴|재밌는|영상|동영상|gag|enjoy|enjoycouple|일상|개그|유머|lala|minddu|네이버|naver|보물섬|더블비|공대생|변승주|대도서관|윰댕|밴쯔|먹방|mukbang|not my arms|챌린지|challenge|팔바꾸기|게임|game|couple game|퓨디파이|김블루|블루|롤|롤드컵|페이커","136040","3201","43","530","https://i.ytimg.com/vi/FXaM6K10jw8/default.jpg","False","False","[ 라라게임 하는 방법! ]1. 네이버 음성검색을 켠다.2. 또박또박한 말투로 영화 명대사 연기한다.( *배우이름 넣으면 더 잘 검색되는건 꿀팁! )3. 검색이 안되면 벌칙 또는 술마시기~![네이버 앱 베타버전 체험하기 - http://bit.ly/2DeD6Ba ]엔조이커플 인스타그램  enjoycouple instargram ▶https://www.instagram.com/enjoycouple/엔조이커플 페이스북  enjoycouple facebook▶https://www.facebook.com/enjoycouple손민수 Minddufacebook    ▶ https://www.facebook.com/mindduartinstargram ▶ https://www.instagram.com/mindduart/임라라  Limlalafacebook   ▶ https://www.facebook.com/limlalalandinstargram ▶https://www.instagram.com/limlalaland/"
"oqsA7DgOucY","그는 새카만 고양이를 키우기 시작했다. 그러나 7년 후, 수의사는 새끼 고양이에 관한 충격적인 사실을 알렸다./Ranking World","2018-10-31T09:26:00.000Z","UCLICXWvsfMX5XPYGuHNQj6g","Ranking World","22","18.01.11","고양이|검은 고양이|그 후|애완 동물|충격적인|사실|수의사|동물|사육|변화|효과|드문|질병|생일|재미|깜짝|감동|/Ranking World|#충격|#발견|#핵꿀잼","39732","279","27","38","https://i.ytimg.com/vi/oqsA7DgOucY/default.jpg","False","False","#충격 #발견 #핵꿀잼1997년, 데이비드 씨는 동물 보호시설에서, 검은 고양이를 만났습니다.이 검은 고양이에게 첫눈에 반한 데이비드 씨. 스크래피라고 이름을 붙이고 집으로 데리고 가기로 결정했는데요.스크래피가 7번째 생일을 맞을 무렵.어떤 변화가 보이기 시작했습니다....고고학자는 지하에 숨겨진 미국의 놀라운 역사를 밝혀내다../Ranking Worldhttps://youtu.be/lfJu7irEMCQ드론으로 소 무리를 촬영하고 있던 남자. 드론이 찍은 영상을 보니 소는 큰 위험에 처해있었다./Ranking Worldhttps://youtu.be/qOGME_JO4oY한 가족이 집 벽에서 이상한 소리를 감지한다. 벽돌 하나를 빼봤더니 놀랄만한 사실이 밝혀졌다./Ranking Worldhttps://youtu.be/CibSKB8Wo3U"
"lop0gPy-X70","[이강인 볼터치] 발렌시아A팀경기 데뷔전에서 뛰어난 경기력을 보여준 이강인!!!!!!!!!!!","2018-10-30T20:25:48.000Z","UCr3G_LF602rAPmF7-xKoPNg","국제축구","17","18.01.11","[none]","245513","628","53","484","https://i.ytimg.com/vi/lop0gPy-X70/default.jpg","False","False",".."
"ToZbL5n-6Dg","김어준의 뉴스공장 10월 31일 방송 1부,2부 / 일본 강제징용 피해자 승소! 아베 국제법 들어 반발, ‘냉면이 목구멍으로 넘어가나’ 기업 총수 향한 리선권의 망언","2018-10-30T23:58:30.000Z","UC0sfSZeoSUeWxys7OKkTelQ","tbs FM","25","18.01.11","김어준의 뉴스공장|김어준|뉴스공장","67879","1446","67","211","https://i.ytimg.com/vi/ToZbL5n-6Dg/default.jpg","False","False","2018년 10월 31일 '김어준의 뉴스공장' _ 1부,2부◎ 1부[이 정도는 알아야 할 아침 뉴스]- 시사IN 김은지 기자◎ 2부[인터뷰 제1공장] -전화연결일본 강제징용 피해자 승소! 아베, 국제법 들어 반발 … 강제징용 판결의 핵심은?- 이장희 명예교수 (한국외국어대 법학전문대학원)[인터뷰 제2공장]‘냉면이 목구멍으로 넘어가나’ 기업 총수 향한 리선권의 발언, 남북 경협에 초치는 망언!- 정세현 전 통일부 장관"
"YBzJ0jmHv-4","[MV] Paul Kim(폴킴) _ Me After You(너를 만나)","2018-10-29T09:00:06.000Z","UCweOkPb1wVVH0Q0Tlj4a5Pw","1theK (원더케이)","10","18.01.11","Kpop|1theK|원더케이|loen|로엔|뮤비|티져|MV|Teaser|신곡|new|song|한류|hallyu|ロエン|ミュージック|ミュージックビデオ|ケーポップ|韓国の歌|アイドル|韓流|韓国|아이돌|idol|Paul Kim|폴킴|Me After You|너를 만나","548895","12266","98","585","https://i.ytimg.com/vi/YBzJ0jmHv-4/default.jpg","False","False","[MV] Paul Kim(폴킴) _ Me After You(너를 만나)*English subtitles are now available. :D(Please click on 'CC' button or activate 'Interactive Transcript' function)[Notice] 1theK YouTube is also an official channel for the MV, and music shows will count the views from this channel too.[공지] 1theK YouTube는 MV를 유통하는 공식 채널로, 1theK에 업로드된 MV 조회수 또한 음악방송 순위에 반영됩니다.:: iTunes : https://itunes.apple.com/album/me-after-you-single/1440476354?l=ko&ls=1&app=itunesHope someone next to you is the perfect love you've been waiting for a long time…#PaulKim#폴킴#Me_After_You#너를만나#NEWRELEASE#MV#1theK#원더케이▶1theK FB  : http://www.facebook.com/1theK▶1theK TW : https://twitter.com/1theK▶1theK Kakao : https://goo.gl/otRpZc"
"QKpvIilYC7A","[마녀사냥FULL] 브래지어 끈을 올려줬던 아는 동생..?★14회-② 다시보기 몰아보기★","2018-10-30T15:58:55.000Z","UCFL1sCAksD6_7JIZwwHcwjQ","JTBC Entertainment","24","18.01.11","JTBC|제이티비씨|KOREA|Broadcast|마녀사냥|다시보기|몰아보기|마녀사냥 FUll|신동엽|성시경|허지웅|샘 해밍턴|마녀|마성의여자|남자|토크|얘기|신체접촉|수영|수영강사|swimming|seductress|the girl|Shin dong yup|Sung si kyung|Heo ji woong|Sam hammington|Witch hunt|greenlight","61571","254","14","41","https://i.ytimg.com/vi/QKpvIilYC7A/default.jpg","False","False","JTBC 마녀사냥 다시보기 몰아보기 (FULL HDTV)☞ https://www.youtube.com/playlist?list=PL5qRfk4DowRCeqQ4gNWpLL17EBI-a84hU브래지어 끈을 올려줬던 아는 동생..?★14회-②♥1일 1마녀사냥 다시보기! 매일 자정 12시에 업로드♥【 NEXT - EP15 】 : 자는 몰골이 흉측한 여자 / 잠자리에서도 생색내기 바쁜 남친 / 나를 돈줄로 생각하는 E컵 여친☞ https://www.youtube.com/playlist?list=PL5qRfk4DowRCYrVhLG0P0xH__c09eQ-jD▒▒▒▒▒▒▒▒▒▒▒▒▒▒▒▒▒▒▒▒▒▒▒▒▒▒▒▒▒▒▒▒▒▒▒▒▒Please enter subtitle of this video in your own language. Anybody can enter subtitle by referring to existing English subtitle.You can make viewers all over the world pleased with your subtitle.Please click below link if you are interested in participating with subtitle.◎ SUBTITLE SUBMITTING TUTORIAL✍ Contribute closed captions and subtitles ☞▶ https://youtu.be/_3MMKHqoZrsJTBC Youtube channel communicating with fans fasterView more videos & informations ☞📢 Homepage : http://www.jtbc.co.kr📢 Youtube : http://www.youtube.com/jtbcentertainment📢 Facebook : https://www.facebook.com/JTBClove📢 Twitter : https://twitter.com/jtbclove📢 INSTAGRAM : https://www.instagram.com/jtbc.insta"
"0BKodRG60Mw","집에 있는 오래된 문방구 슬라임 모두 섞기 (옛날 젤리괴물 부터 신상 문방구 수제 슬라임까지) 액괴 다 섞기 | 마이린 TV","2018-10-31T07:00:01.000Z","UCNzn4cWu4ygeWTxXfP4ufug","마이린 TV","24","18.01.11","마이린|마이린TV|슬라임 모두 섞기|오래된 슬라임 모두 섞기|액괴 다 섞기|액괴 모두 섞기|슬라임 다 섞기|문방구 슬라임|문방구 액괴 섞기|문방구 슬라임 섞기","45105","768","50","303","https://i.ytimg.com/vi/0BKodRG60Mw/default.jpg","False","False","오늘은 마이린이 집에 있는 오래된 문방구 슬라임을 모두 섞었어요. 마이린 방에 있는 슬라임 냉장고 속 문방구 액괴를 포함, 여기저기 흩어져있는 문방구 슬라임을 모두 찾아 섞어보았어요. 옛날 젤리괴물부터 신상 문방구 수제 슬라임까지 모두 섞어보았는데요. 어떤 컬러와 어떤 느낌이 될지 정말 궁금하네요. 여러분도 오늘 영상 끝까지 재미있게 봐주세요~"
"_m97yPr8RlY","[충격] '불타는 청춘' 이경진, 암투병 충격 슬픈 근황, 그녀의 고독한 삶은 사는 이유! 첫째 남편 파혼했고 둘째 남편 이혼된 진실 [K연예HOT]","2018-10-31T04:55:44.000Z","UCJkqeAzKoaaDKengnrUu8Ng","K연예HOT","22","18.01.11","불타는 청춘 이경진|암투병 충격 슬픈 근황|그녀의 고독한 삶은 사는 이유|첫째 남편 파혼했고 둘째 남편 이혼된 진실 이유|이경진 결혼|이경진 파혼|이경진 이혼|이경진 남편|이경진 암투병|624545|K연예HOT #youtube","45273","94","30","17","https://i.ytimg.com/vi/_m97yPr8RlY/default.jpg","False","False","[충격] '불타는 청춘' 이경진, 암투병 충격 슬픈 근황, 그녀의 고독한 삶은 사는 이유! 첫째 남편 파혼했고 둘째 남편 이혼된 진실 이유구독 신청 여기채널: https://goo.gl/fNrVrh연락처: nuem93@gmail.com제 동영상 신청해 주셔서 감사 드립니다"
"u0Zu5CmXXiQ","랜드로버...더는 못 타겠습니다ㅡㅡ 진짜 답이 없습니다. [성명준]","2018-10-31T09:54:46.000Z","UCFIeZnCOh_7JZAgJB3XaLXw","성명준","2","18.01.11","성명준|인천대장|외제차|차|자동차|랜드로버|레인지로버|보그|결함|하자|랜드로버사태|재규어","288394","8998","235","2883","https://i.ytimg.com/vi/u0Zu5CmXXiQ/default.jpg","False","False","랜드로버...더는 못 타겠습니다ㅡㅡ 진짜 답이 없습니다. [성명준]#레인지로버 #랜드로버 #성명준 #랜드로버사태 #보그 #결함 #하자 #걍2억짜리똥"
"adnp5PgJfDg","BTS 리더 RM의 빌보드200차트 소식과 감동스런 해외반응! BTS, RM is ranked 26th on the Billboard 200 chart![바이스톰][ENG SUB]","2018-10-31T11:53:39.000Z","UCmdzTwJ_Ge_T6L8NyWMk5MA","바이스톰 By Storm","24","18.01.11","해외반응|외국인반응|BTS해외반응|RM해외반응|RM 아미반응|RM 빌보드 진입|RM26위|RM 빌보드200|RM billboard|남준 해외반응|방탄소년단 RM 해외반응|RM 빌보드차트|RM mono|RM solo album|RM 솔로 앨범|RM 모노|RM 믹스테잎|RM mixtape|BTS|RM|RM 솔로 반응|알엠 모노 반응","27486","1364","8","307","https://i.ytimg.com/vi/adnp5PgJfDg/default.jpg","False","False","자랑스런 RM이 또 하나의 기적을 만들었네요!충분히 그럴 가치가 있는 앨범이라서 더욱 기분 좋습니다!그리고 그 생각은 해외의 팬들도마찬가지인 듯 합니다!관련 기사와 해외팬들 반응 준비 했으니즐겁게 보시구요!그리고 1만 구독자 축하해 주시고만들어주신 감사한 레이니님들!!정말 정말 다시 한번 감사드려요!!ㅠㅠ원문 궁금하신 분들은고정 댓글에 번역 해두었으니관심 있으신 분들은 확인하세요!___________________________________________RM has performed another miracle!We're happy because mono deserves it!I hope you enjoy the video!Thank you all for helping us reach 10,000 subscribers!___________________________________________빌보드 영상 뉴스 링크(Billboard News Video): https://www.youtube.com/watch?v=l4r911OZL5U&t=3s빌보드 제프 벤자민 기사(Billboard Article by Jeff Benjamin): https://www.billboard.com/articles/columns/k-town/8482362/bts-rm-billboard-200-chart-mono____________________________________________영상 출처 (Video Source)RM P.D.D. M/V: https://www.youtube.com/watch?v=WFArWe1MLW8____________________________________________음원정보 (BGM Sources)Forever Rain by RM: https://www.youtube.com/watch?v=Cvb76hBX_Oc&t=49sInspiration by Rafael Krux: https://www.youtube.com/watch?v=67MisL1EkvM&index=64&list=PLyrrhz0LjbCJ69qLMeiKPvHYR2xfKbAlNTrack : EK-07 - At This MomentMusic by EK-07 , https://soundcloud.com/ek-07 Follow artist http://bit.ly/2LsTYbaMusic Promoted by http://bit.ly/DayDream_YoutubeUhgood by RM"
"3seGMxAQNXc","문재인 경제 파탄 박근혜 한테 뒤집어 씌우려 하나?   덕분에 박근혜  경제 끝판왕 부각 !!!","2018-10-31T11:00:47.000Z","UC-ziTEER8R_H2ZPElz9WtxA","정은킬","22","18.01.11","문재인|경제|경기|폐업|실업률|자영업자|탄핵|하야|문재인탄핵|문재인하야|박근혜|YTN|고용|김정숙|냉면|리선권|서훈|조명균|트럼프|김정은|trump|north korea|kim jong un|south korea|seoul|moon jae in","24896","1427","33","273","https://i.ytimg.com/vi/3seGMxAQNXc/default.jpg","False","False","문재인 경제 파탄 박근혜 한테 뒤집어 씌우려 하나?  덕분에 박근혜  경제 끝판왕 부각 !!!"
"EwwRfzLH-pA","수줍어하던 초등학생의 반전 파워슛팅ㄷㄷ","2018-10-31T09:00:02.000Z","UC8valWz_8jFnX4tMGCeC62w","석꾸축꾸","17","18.01.11","축구","150792","2135","46","556","https://i.ytimg.com/vi/EwwRfzLH-pA/default.jpg","False","False","석꾸 골키퍼를 상대로 페널티킥 10번 성공시켜라!석꾸축꾸 구독 바로가기▶ https://goo.gl/WpMIPY월수금 오후6시 영상 업로드!"
"GOhmoC7m3h8","10월31일 6시 PenN뉴스_루머 단속하면 세컨더리 보이콧 안하나?ㅣ 소득 주도 성장 論 실패, 인정하라!ㅣ '5.18 성폭행' 발표가 수상하다外","2018-10-31T11:21:09.000Z","UCOqCunaF9qVN8bXwsK0HT3g","펜앤드마이크 정규재TV","25","18.01.11","펜앤드마이크|정규재tv|펜앤뉴스|PenN|정규재|최대현|적폐청산|사법농단|김시철|댓글조작|원세훈|국정원|양승태|최인석|강민구|임종헌|김태규|답정너|국정지지율|한국경제|평양공동선언|판문점선언|군사분야합의서|한국갤럽|리얼미터|국가인권위원회|여성가족부|국방부|성폭행|계엄군|광주|금남로|광주교도소|5.18|세컨더리 보이콧|미국 중간선거|재무부|금융위원회|북한|이란|김정은|뱅코 델타 아시아|IMF|ZTE|남북철도|미국|중국|문재인|소득주도 성장|주광덕|국회의원|동행지수|통계청|소비지표|이병태|카이스트|경제|자동차|부동산|공동조사단|국제거래|은행|루머|금융위원장|김광두|장하성|후원자대회|헬기|기총소사|매뉴얼|광주시보상심의자료|문헌방송자료|군인|지지율|판문점|경제실책|경기불황|사법부|검찰|피의사실|압수수색|판사|자유한국당|형사소송법|법제사법위원회|윤석열|노무현|이명박|박근혜|고용세습|1인시위|양승동|국정감사|권력형 비리|KBS|세월호","105047","23432","130","738","https://i.ytimg.com/vi/GOhmoC7m3h8/default.jpg","False","False","[주요뉴스] 03:0201. 정부, 세컨더리 보이콧 루머 엄정 대처 04:4602. 소득주도 성장은 실패했다…소비·생산 모두 하락 09:0603. 5.18 계엄군 집단 성폭행 정부의 이상한 발표 13:0404. 정규재 주필의 뉴스논평 15:4505. 文지지율, 못한다 38.9 잘한다 36.6 28:5606. '사법부는 들끓고 있다' 33:0407. PenN 초대석 : 주광덕 의원 - 우리법연구회 빠지면 특별재판부 가능하다 36:2308. 서울시 '고용세습' 규탄 대학생, 시민 시위 이어져 48:2109. (단) KBS 이사회, 양승동 사장 연임 의결 51:3010. PenN 퀴즈쇼 52:43[알립니다]* 화질이 좋지 않을 때 *동영상에서 오른쪽 밑에 ⚙ ←이 버튼을 눌러주시고 화질을 480p 이상으로 설정해주세요* 방송시작 알람 받기 *알림이 안 오신 분들은 구독버튼 옆에🔔종모양🔔이 눌려있는지 확인해주세요👌* 월 1만원 정기구독이면 나라를 지킵니다! *1) 펜앤마이크 후원 바로가기: http://www.pennmike.com/com/spon.html2) 일시후원 계좌:  기업은행 024-088734-01-018 (주식회사 펜앤드마이크)     정기후원 계좌: 기업은행  024-088734-04-046 (주식회사 펜앤드마이크)진행: 정규재 펜앤마이크 대표/주필, 최대현 펜앤마이크 앵커제보/문의: penn@pennmike.com"
"e4eiEVOylZ8","(실화) 결혼식장 직원이 팬치였던 썰 - 왁굳의 노가리","2018-10-31T09:00:03.000Z","UCBkyj16n2snkRg1BAzpovXQ","우왁굳의게임방송","20","18.01.11","우왁굳|우왕굳|우왁굳의게임방송|왁굳|왁두|종합게임|리그오브레전드|롤|스팀게임|쿠소게임|인디게임|비디오게임|레이싱게임|레이스게임|오버워치|배틀그라운드|배그|포트나이트|포나|결혼식장|결혼식 직원|결혼식|우왁굳 결혼|우왁굳 엔젤|우왁굳 엔젤님|김수현 아나운서","146766","3601","36","618","https://i.ytimg.com/vi/e4eiEVOylZ8/default.jpg","False","False","(실화) 결혼식장 알바가 팬치였던 썰 - 왁굳의 노가리● 유튜브로는 못보는 생방송       : http://bit.ly/2byvfQH● 우왁굳 네이버 팬카페               : http://bit.ly/1Q4619k● 우왁굳과 뇌 링크하기              :  http://bit.ly/1SHKd34● 우왁굳 카카오톡 아이디          : @우왁굳● 영상 업로드 시간                      :  매일 오전 중-------------------------------------------------------------------------- 트위치 게임 스트리머 우왁굳의 유튜브입니다 :)생방송에서 공략한 게임 혹은 유튜브만의 편집영상이 올라옵니다.많은 사랑 부탁드립니다.------------------------------------------------------------------------문의, 편집영상등은 이곳으로 :) ※ E-Mail : ecvhao@naver.com"
"lGZzRopbkZE","[토미] 미국으로 입양온 아이가 영어를 배우자 충격적인 이야기를 꺼낸다.. | 토요미스테리 | 디바제시카","2018-10-31T09:20:55.000Z","UCh6O-aBKR-99dg4rPy69CXg","디바제시카DeevaJessica","27","18.01.11","디바제시카","42952","1059","25","145","https://i.ytimg.com/vi/lGZzRopbkZE/default.jpg","False","False","■생방 일정금요일 밤 11시: 금요사건파일 (카카오 TV)토요일 밤 11시: 토요미스테리 (카카오 TV)비지니스 문의: jbsnetworkk7@gmail.comInstagram 인스타: 디바제시카 검색감사합니다."
"tBzkT9tQSmg","서장훈 아내 오정연 이혼이유 보리차 사건...충격적인 사실이 드러났다!","2018-10-31T06:00:07.000Z","UCLsQqvrY-C1D9LXsJGAXJHw","24 News KR","24","18.01.11","서장훈|아내|오정연|이혼이유|보리차|사건|24 news kr|UCLsQqvrY-C1D9LXsJGAXJHw|youtube","17129","50","33","4","https://i.ytimg.com/vi/tBzkT9tQSmg/default.jpg","False","False","서장훈 아내 오정연 이혼이유 보리차 사건...충격적인 사실이 드러났다! real more video :https://goo.gl/HRZyiU thanks for whatching if you are channel to subcriber : https://goo.gl/XyJ5j4"
"YxTyHLB-FEI","[이수근채널] 《이수근 VS 강호동》 우정출연 하다 뒷목 잡은 강호동! 1점내기 끝장 승부의 결말은?","2018-10-30T06:38:12.000Z","UCxPtZG-Ou0v1hsUzXXu2Jsg","이수근 채널","23","18.01.11","이수근채널|이수근|강호동|유남석|조명우|당구|쓰리쿠션|대결|아는형님|신서유기|호동|수근|당구선수|SM","468499","3766","134","401","https://i.ytimg.com/vi/YxTyHLB-FEI/default.jpg","False","False","만능 스포츠맨 이수근. 그에게 도전하고 싶은 사람 여기 여기 붙어라~우리끼리 만들어서 우리끼리 운영하는 [우리들만의 리그] 그 첫 번 째! [당구]시청자들의 도전장이 접수 되는 즉시 이수근 사단이 묻지도 따지지도 않고대결에 들어간다. SM 커뮤니케이션센터에 마련된 오직 우리들만을 위한 당구장!당구 잘 친다는 사람들은 다 모여라! 이수근과 벌이는 피도 눈물도 없는 한판승부!"
"Mmv6Vpn0ynk","여기 브이로그 잘하는집~ 유튜버의 하루/ 퍼스널컬러진단 [여정을떠난여정]","2018-10-30T09:00:03.000Z","UCsU2RlGgybcLzfmBqnTx-Rw","여정을떠난여정","23","18.01.11","선여정|여정을떠난여정|웃긴영상|메이크업|화장|makeup|자취|자취생|요기요|배달통|배달음식|한국|korea|퍼스널컬러|브이로그","192456","5179","71","890","https://i.ytimg.com/vi/Mmv6Vpn0ynk/default.jpg","False","False","인스타그램: seon_y_j페이스북: 선여정 / 여정을떠난여정 페이지-*본 영상에는 이니스프리의 간접광고가 포함되어 있습니다.*_👉퍼스널 컬러 정보👈 ▫️바른스타일 컨설팅 예약 링크https://booking.naver.com/booking/6/bizes/155037/items/2772811▫️인스타그램https://www.instagram.com/h_yemini/영상을 본 뒤 @좋아요@를 눌러주시는건다음 영상을 더 열심히 만들수있습니다.  ^센스있게 눌러주십시오^그런뒤  온갖 재롱과 끼 부리는 제가 마음에 들었다면 @구독@도 누르는 것 ..잊지 마십시오...꼭...누르기..손가락 얹혀놓기..엄지로 꾸욱 검지도 갠찬ㅎ 중지는 쫌....#퍼스널컬러#브이로그-더많은 콩고물을위해 여떠여 영상 번역 도와주러 가기!!http://www.youtube.com/timedtext_cs_panel?tab=2&c=UCsU2RlGgybcLzfmBqnTx-Rw"
"ddgMnObtzRk","DSR 실행 왜 공포 분위기를 조성 하는가? 강남과 마용성 폭망설을 흘리고 있는 이유","2018-10-31T09:51:57.000Z","UCj2gpUrZ7LMp4Mp1pVMKz0g","도봉박홍기","25","18.01.11","[none]","31930","2435","70","74","https://i.ytimg.com/vi/ddgMnObtzRk/default.jpg","False","False","우리 은행  1005 - 203 - 205878   박 홍기 (대동포럼)소액 교육비  후원을 환영하며 10만원 이상은 정중하게 사절 합니다.http://news.naver.com/main/read.nhn?mode=LS2D&mid=shm&sid1=101&sid2=260&oid=215&aid=0000597585https://www.kbfg.com/kbresearch/index.do?alias=report&viewFunc=research_details&categoryId=1&subCtgId=&menuId=&boardId=&rBoardId=103&articleId=1003610&sTxt=&sType=&pageNo=1http://weekly.donga.com/List/3/all/11/98758/1http://bizn.donga.com/realestate/East/3/all/20171220/87828429/1http://news.joins.com/article/22230936http://cafe456.daum.net/_c21_/recent_bbs_read?grpid=1OaUj&fldid=Mhu3&page=1&prev_page=0&contentval=000bYzzzzzzzzzzzzzzzzzzzzzzzzz&datanum=2328&regdt=20180107180844&listnum=20http://news.kbs.co.kr/news/view.do?ncd=494457http://www.yeongnam.com/mnews/newsview.do?mode=newsView&newskey=20180109.010160759310001"
"kkuwMi5XrKw","얼마전 이별한 동생 앞에서 이별노래를 틀었더니 동생 움 ...;; HANA 김하나","2018-10-30T09:30:03.000Z","UCfTswP_uNy_h86pUjCU410A","HANA 김하나","23","18.01.11","김하나|엔터|유머|재미|개그|코미디|엽기|도전|챌린지|리뷰|후기|동생|남매|현실남매|흔한남매|김하나 동생|동동이|김하나 동동이|김동현|김하나 김동현|김하나 가족|김하나 강아지|남동생|여동생|누나|언니|오빠|형|장난|이별|헤어짐|커플|솔로|솔로 노래|이별 노래","255087","8667","174","1524","https://i.ytimg.com/vi/kkuwMi5XrKw/default.jpg","False","False","오늘도 좋은 하루 !!----------------------------------------­­-----------김하나의 영상 무료로 감상하기: https://goo.gl/MCJxuS김하나의 인스타그램 구경하기: https://goo.gl/SQLiWq----------------------------------------­­-----------COPYRIGHT ⓒ 2018 HANA ALL RIGHTS RESERVED.----------------------------------------­­-----------"
